{
  "schemaVersion": 3,
  "phase": "AS",
  "phaseName": "Astronautical Sciences",
  "courseAssignment": "STC",
  "sourceDocument": "MCG 26A",
  "extractedAt": "2026-02-22",
  "transformedAt": "2026-02-27",
  "pageRange": {
    "start": 42,
    "end": 62
  },
  "figures": [],
  "modules": [
    {
      "moduleCode": "AS 6000",
      "moduleName": "Fundamentals",
      "parentCourse": null,
      "courseAssignment": "STC",
      "tlos": [],
      "events": []
    },
    {
      "moduleCode": "AS 6100",
      "moduleName": "MATLAB Primer",
      "parentCourse": "AS 6000 Fundamentals",
      "courseAssignment": "STC",
      "tlos": [
        "TLO 1. Recall the basics of MATLAB including declaring variables, simple arithmetic operations, vectors and arrays, loops, functions, and plotting."
      ],
      "events": [
        {
          "code": "AS 6101B",
          "eventName": "MATLAB Primer",
          "eventType": "B",
          "eventTypeName": "Background/Pre-Work",
          "section": "Academics",
          "courseAssignment": "STC",
          "courseAssignmentSource": "module",
          "applicability": [],
          "applicabilityDetail": {
            "positions": [
              "P",
              "FTE",
              "CSO",
              "ABM",
              "RPA"
            ],
            "courseType": null,
            "clearance": null
          },
          "description": "This event completed prior to arrival at the school gives the student the necessary skills using MATLAB for the following modules within the course.",
          "duration": null,
          "prerequisites": [
            {
              "code": null,
              "name": "TPS Enrollment",
              "requiredFor": null,
              "scope": {
                "positions": [
                  "inherit"
                ],
                "pilotType": null,
                "crewSoloAircraft": null,
                "dataGroup": null,
                "clearance": null
              },
              "alternative": null,
              "partialCompletion": null,
              "isExternal": false,
              "externalPhase": null,
              "errata": "TPS Enrollment",
              "originalNotes": "TPS Enrollment"
            }
          ],
          "schedulingNotes": null
        }
      ]
    },
    {
      "moduleCode": "AS 6200",
      "moduleName": "Inertial Orbits",
      "parentCourse": "AS 6000 Fundamentals",
      "courseAssignment": "STC",
      "tlos": [
        "TLO 1. Use the basic vocabulary of orbits to describe a satellite's motion through space.",
        "TLO 2. Transform satellite position between a variety of inertial and relative coordinate frames.",
        "TLO 3. Propagate orbits over time to estimate the future position of a satellite.",
        "TLO 4. Complete multi-step calculations to complete an orbit transfer in inertial space and assess the pros and cons of different typed of transfer maneuvers.",
        "TLO 5. Understand the maneuver primitives associated with satellite motion in relative space."
      ],
      "events": [
        {
          "code": "AS 6201A",
          "eventName": "The Space Environment Lecture",
          "eventType": "A",
          "eventTypeName": "Academic Lecture",
          "section": "Academics",
          "courseAssignment": "STC",
          "courseAssignmentSource": "module",
          "applicability": [],
          "applicabilityDetail": {
            "positions": [
              "P",
              "FTE",
              "CSO",
              "ABM",
              "RPA"
            ],
            "courseType": null,
            "clearance": null
          },
          "description": "This block includes the definition of space, basic physics of space, the natural space environment, the man-made space environment, the physical laws that govern the movement of an orbital body, Kepler's Laws, Newton's Laws, Universal Laws of Gravity, and movement in orbits, solar winds and other effects on space craft. The lecture is followed by a series of case studies of issues/failures of satellites encountered due to the Space Environment related to the environment in practical situations.",
          "duration": null,
          "prerequisites": [
            {
              "code": "AN 5150A",
              "name": "Astronautical Phase Introduction",
              "requiredFor": null,
              "scope": {
                "positions": [
                  "inherit"
                ],
                "pilotType": null,
                "crewSoloAircraft": null,
                "dataGroup": null,
                "clearance": null
              },
              "alternative": null,
              "partialCompletion": null,
              "isExternal": false,
              "externalPhase": null,
              "errata": null,
              "originalNotes": null
            }
          ],
          "schedulingNotes": null
        },
        {
          "code": "AS 6202W",
          "eventName": "The Space Environment Assessment",
          "eventType": "W",
          "eventTypeName": "Working Group",
          "section": "Academics",
          "courseAssignment": "STC",
          "courseAssignmentSource": "module",
          "applicability": [],
          "applicabilityDetail": {
            "positions": [
              "P",
              "FTE",
              "CSO",
              "ABM",
              "RPA"
            ],
            "courseType": null,
            "clearance": null
          },
          "description": "This block includes the definition of space, basic physics of space, the natural space environment, the man-made space environment, the physical laws that govern the movement of an orbital body, Kepler's Laws, Newton's Laws, Universal Laws of Gravity, and movement in orbits, solar winds and other effects on space craft. The lecture is followed by a series of case studies of issues/failures of satellites encountered due to the Space Environment related to the environment in practical situations.",
          "duration": null,
          "prerequisites": [
            {
              "code": "AN 5150A",
              "name": "Astronautical Phase Introduction",
              "requiredFor": null,
              "scope": {
                "positions": [
                  "inherit"
                ],
                "pilotType": null,
                "crewSoloAircraft": null,
                "dataGroup": null,
                "clearance": null
              },
              "alternative": null,
              "partialCompletion": null,
              "isExternal": false,
              "externalPhase": null,
              "errata": null,
              "originalNotes": null
            }
          ],
          "schedulingNotes": null
        },
        {
          "code": "AS 6203Z",
          "eventName": "The Space Environment Debrief",
          "eventType": "Z",
          "eventTypeName": "Debrief",
          "section": "Academics",
          "courseAssignment": "STC",
          "courseAssignmentSource": "module",
          "applicability": [],
          "applicabilityDetail": {
            "positions": [
              "P",
              "FTE",
              "CSO",
              "ABM",
              "RPA"
            ],
            "courseType": null,
            "clearance": null
          },
          "description": "This block includes the definition of space, basic physics of space, the natural space environment, the man-made space environment, the physical laws that govern the movement of an orbital body, Kepler's Laws, Newton's Laws, Universal Laws of Gravity, and movement in orbits, solar winds and other effects on space craft. The lecture is followed by a series of case studies of issues/failures of satellites encountered due to the Space Environment related to the environment in practical situations.",
          "duration": null,
          "prerequisites": [
            {
              "code": "AN 5150A",
              "name": "Astronautical Phase Introduction",
              "requiredFor": null,
              "scope": {
                "positions": [
                  "inherit"
                ],
                "pilotType": null,
                "crewSoloAircraft": null,
                "dataGroup": null,
                "clearance": null
              },
              "alternative": null,
              "partialCompletion": null,
              "isExternal": false,
              "externalPhase": null,
              "errata": null,
              "originalNotes": null
            }
          ],
          "schedulingNotes": null
        },
        {
          "code": "AS 6210A",
          "eventName": "Inertial Orbits Lecture",
          "eventType": "A",
          "eventTypeName": "Academic Lecture",
          "section": "Academics",
          "courseAssignment": "STC",
          "courseAssignmentSource": "module",
          "applicability": [],
          "applicabilityDetail": {
            "positions": [
              "P",
              "FTE",
              "CSO",
              "ABM",
              "RPA"
            ],
            "courseType": null,
            "clearance": null
          },
          "description": "These lectures cover Inertial Orbits with topics in Orbit Basics, Classical Orbital Elements, Orbit Regimes, Sidereal & Solar Time Comparison, Perturbations, Maneuver Forensics as related to Perturbations, Ground Traces, Orbital Coordinate Frames, and Time Systems. Students will be expected to perform hand calculations related to the topics presented, create their own tools to perform repeated calculations, and will be assigned homework and projects to reinforce concepts presented in block. Students will utilize Systems Tool Kit Software & www.usspacetraining.com as learning aids in visualizing concepts and for use in assigned projects.",
          "duration": null,
          "prerequisites": [
            {
              "code": "AN 5150A",